{
  "schema_version": "0.1.0",
  "max_turns": 12,
  "max_provider_calls": 12,
  "max_tool_calls": 8,
  "max_candidates": 2,
  "max_experiments": 2,
  "max_experiment_commands": 4,
  "max_wall_seconds": 300,
  "max_request_bytes": 262144,
  "max_response_bytes": 65536,
  "max_total_request_bytes": 1048576,
  "max_file_bytes": 65536,
  "max_search_matches": 64,
  "max_inventory_entries": 500,
  "max_observations": 500
}
